id,title,subtitle,price,price_gbp,price_freq,price_pcm_est,bedrooms,bathrooms,property_type,transaction_type,available,archived,address_display,latitude,longitude,phone,phone_digits,agency_company,agency_branch,agency_address,tags,features,photos_count,floorplans_count,description
166219262,"1 bedroom apartment for rent in Park Road, Hampton Hill, TW12",1 bedroom apartment,"£1,350 pcm",1350,pcm,1350,1,1,Apartment,RENT,True,False,"Park Road, Hampton Hill",51.42924,-0.35438,020 3907 7857,02039077857,Anthony James Manser,Isleworth,"22 St. Johns Road, Isleworth, TW7 6NW",,,6,0,"A well presented apartment located in central affluent Hampton Hill! This stylish apartment benefits from a double bedroom with built in wardrobes, spotlights throughout, neutral colours decorated through out. Boasting a spacious lounge and modern open plan kitchen. Great location for shops and Fulwell Train Station. · ·"
166219760,"1 bedroom flat for rent in Saxon Close, Surbiton, KT6",1 bedroom flat,"£1,350 pcm",1350,pcm,1350,1,1,Flat,RENT,True,False,"Saxon Close, Surbiton, KT6",51.39077,-0.30531,020 3834 8662,02038348662,Leaders and Romans Group,Surbiton,"19/21 Claremont Road, Surbiton, KT6 4QR",,One Bedroom Apartment · Close to Train Station · Neutral Decor · Allocated Parking Space · Available in October · Unfurnished,9,1,"Situated a few minutes walk form Surbiton station is this one bedroom apartment. The property benefits from open plan kitchen, double bedroom and great location. · · Rent excludes the tenancy deposit and any other permitted payments. Please contact us for further information or visit our website"
166219931,"1 bedroom apartment for rent in Warden Avenue, Rayners Lane, HA2",1 bedroom apartment,"£1,400 pcm",1400,pcm,1400,1,1,Apartment,RENT,True,False,"Warden Avenue, Rayners Lane, HA2",51.572544,-0.376206,01895 544753,01895544753,Coopers,Ruislip,"126 - 128 High Street, Ruislip, Middlesex, HA4 8LL",,Walking Distance to High Street · Part furnished · Double Bedroom · New Kitchen · Top Floor Flat · Split-Level · Unlimited Street Parking · Minutes from Station · Double Glazed · Gas Central Heating,4,1,A one bedroom apartment perfectly situated for the commuter needing EASY ACCESS to transport links into central London. Situated CLOSE to Rayners Lane station (Metropolitan/Piccadilly lines) and a SHORT DRIVE from Harrow shopping centre this SPLIT LEVEL flat comprises open planned lounge/kitchen area with bedroom and bathroom above. Benefits include gas central heating and double glazed windows. · · Available beginning of September and offered part furnished. · ·
166234496,"1 bedroom apartment for rent in Yeend Close, West Molesey, KT8",1 bedroom apartment,"£1,250 pcm",1250,pcm,1250,1,1,Apartment,RENT,True,False,"Yeend Close, West Molesey, KT8",51.40204,-0.37117,01932 504590,01932504590,Leaders and Romans Group,Walton on Thames,46 High Street Walton-On-Thames KT12 1BY,,One Double Bedroom · Outside Space · Spacious Lounge · Allocated Parking · Security Entry · EPC Rating - C,10,1,"Leaders Walton are pleased to offer this one-bedroom apartment to the rental market. Located in a popular residential area, the apartment features a spacious lounge with doors opening onto a private terrace, a separate kitchen with plenty of storage, a functional bathroom, and a double bedroom with space for furniture. Whilst being close to local amenities, it offers comfortable living with the benefit of an allocated parking space and secure entry system. Available unfurnished from 12th September 2025. Deposit payable is £1,442.31. A Holding Deposit of £288.46 based on the advertised rent, is required to reserve this property."
166235945,"1 bedroom flat for rent in Sycamores, Kenley Lane, Kenley, CR8",1 bedroom flat,"£1,400 pcm",1400,pcm,1400,1,1,Flat,RENT,True,False,"Sycamores, Kenley Lane, Kenley",51.32462,-0.100745,020 8660 8228,02086608228,Frost Estate Agents,Purley,"1 Purley Road, Purley, CR8 2HA",NEW_HOME,Superb First Floor One Bedroom Modern Apartment · Wonderful Kitchen and Bathroom · Underfloor Heating · Ideal Location For Commuters · Neff Appliances  · Well Presented,9,1,"Frost Estate Agents are delighted to present to the rental market this brand new one bedroom apartment located in leafy Kenley, adjacent to Kenley train station. Finished to an exceptional standard and offering an opportunity for a tenant to enjoy luxury living within a newly built development.FIRST FLOOR WITH ONE BEDROOM – OPEN PLAN LIVING – LARGE BALCONY – 540 SQ/FT · Features include; a bespoke kitchen with brushed finish handles and Quartz stone worktops, Neff appliances (hob, extractor fan, washer/dryer, oven, dishwasher), designer fully tiled bathroom, underfloor heating throughout, engineered wood flooring & luxury carpets, video entry system and secure cycle storage.LOCATIONTransportation: From Kenley Station you can take your pick from Victoria or London Bridge as destinations – all around 35 minutes’ travel time. Road links are excellent too, with the A23 a matter of minutes away, providing fast, easy access to London, the South Coast and the M25."
166238651,"1 bedroom flat for rent in Veronica Gardens, London, SW16",1 bedroom flat,"£1,200 pcm",1200,pcm,1200,1,1,Flat,RENT,True,False,"Veronica Gardens, London",51.410996,-0.144567,020 8629 8029,02086298029,Dexters,Norbury,"1341 London Road, London, SW16 4BE",,One double bedroom · Nice layout · Secure building · Close to transport links · Open-plan kitchen/reception · Breakfast bar · Single occupant only,4,0,"Presenting a ground-floor one double bedroom apartment, it offers a petite kitchen with breakfast bar and nice layout throughout. It is situated in a secure building, close to amenities and transport links. This is for a single occupant only and comes unfurnished. · ·"
166238690,"1 bedroom apartment for rent in Vicarage Farm Road, Hounslow, TW3",1 bedroom apartment,"£1,300 pcm",1300,pcm,1300,1,1,Apartment,RENT,True,False,"Vicarage Farm Road, Hounslow",51.475731,-0.384506,0238 214 8291,02382148291,Woodlands (West London) Ltd,Isleworth,"16 St. Johns Road, Isleworth, TW7 6NW",,One Bed Apartment · Large Lounge with TV · Separate kitchen with appliances · Fully tiled Shower Room · Bedroom with custom wardrobe · Including Gas/Elec/Broadband · Walking distance to Hounslow West Tube · Near Heathrow Airport,4,0,"PROPERTY DESCRIPTIONA ground floor studio apartment with separate kitchen in Hounslow, a short walk to Hounslow West Tube and local shops. Rent inclusive of utility bills and Wi-Fi access.ACCOMMODATIONThe property offers entrance into a large area that has custom built full length wardrobes, bed, desk and television. The property also offers a fully tiled bathroom and fitted kitchen with all appliances.TRANSPORT LINKS & NEARBYConveniently located on the border of Hounslow West & Heston you are within walking distance of Hounslow West Tube Station as well as the restaurants/shops of Bath Road. Heathrow Airport is also as short commute away.ADDITIONAL INFORMATIONFurnished, EPC rating D, Available 15-09-2025, Council Tax - Band A (London Borough of Hounslow) £1622 per annum, Length of tenancy 6-24 months, Deposit £1500.00"
166239644,"1 bedroom flat share for rent in Seacole Close, London, W3",1 bedroom flat share,"£1,100 pcm",1100,pcm,1100,1,1,Flat Share,RENT,True,False,"Seacole Close, London, W3",51.51964,-0.260947,020 3322 3265,02033223265,Techbeard Ltd,London,"20 Wenlock Road, London, N1 7GU",,No Agent Fees · Room Only (Shared Flat) · Students Can Enquire · Bills Included · Property Reference Number: 2047739,14,0,"Property Reference: 2047739. · · PLEASE PLEASE ... INTRODUCE YOURSELF FIRST AND WHAT IS YOUR SITUATION · Viewing highly recommended. · · - Large Room with Dressing; the room got a big mirrored wardrobe and extra shoes place and xtra coat stand.. £1400 · · - Small double; it comes with electric raise bed where you can store more stuff under the bed. The room is cosy and there is integrated mirrored wardrobe... £1050 · · Minimum tenancy is 3 months · Maximum number of tenants is 1 per room · · If two friends want to rent it together it will be separate tenancy agreements (preferred option) · · Council tax included + Internet + Water .. Tenants to pay; Electricity only · · Summary & Exclusions: · - Rent Amount: 2 rooms available, from £1,100.00 each per month (£253.85 per week) · - Deposit / Bond: from £1,100.00 per room · - 2 Bedroom Property (2 rooms currently available for rent) · - 1 Bathrooms · - Property comes furnished · - Available to move in from 26 August 2025 · - Minimum tenancy term is 3 months · - Maximum number of tenants is 2 · - DSS enquiries welcome · - Students welcome to enquire · - No Pets, sorry · - No Smokers · - Not Suitable for Families / Children · - Bills Included · - Property has parking · - Property has garden access · - EPC Rating: EPC Not Required (Shared Accommodation) · · If calling, please quote reference: 2047739 · · Fees: · You will not be charged any admin fees. · · · ** Contact today to book a viewing and have the landlord show you round! ** · Request Details form responded to 24/7, with phone bookings available 9am-9pm, 7 days a week. ·"
166240232,"1 bedroom flat share for rent in Kingsdown House, London, E8",1 bedroom flat share,"£1,000 pcm",1000,pcm,1000,1,1,Flat Share,RENT,True,False,"Kingsdown House, London, E8",51.5523,-0.06538,020 3322 3265,02033223265,Techbeard Ltd,London,"20 Wenlock Road, London, N1 7GU",,No Agent Fees · Room Only (Shared Flat) · Students Can Enquire · Bills Included · Property Reference Number: 2593972,4,0,"Property Reference: 2593972. · · ALL BILLS INCLUDED · · A lovely double room to let located in a great location next to Hackney Downs Park. This spacious room is fully furnished benefitting from a spacious bright and airy living room, kitchen and modern bathroom. Property consists of 2 bedrooms in total. 5 minutes walking distance to Hackney Downs station with trains to Liverpool Street and Kingsland Shopping Centre is minutes walk away with shops, cafes and restaurants close by. · · Viewings are higly recommended! · · Summary & Exclusions: · - Rent Amount: £1,000.00 per month (£230.77 per week) · - Deposit / Bond: £1,000.00 · - 2 Bedroom Property (1 room currently available for rent) · - 1 Bathrooms · - Property comes furnished · - Available to move in from 30 September 2025 · - Minimum tenancy term is 6 months · - Maximum number of tenants is 1 · - Students welcome to enquire · - No Pets, sorry · - Smokers considered · - Not Suitable for Families / Children · - Bills Included · - Property has parking · - No Garden Access · - EPC Rating: EPC Not Required (Shared Accommodation) · · If calling, please quote reference: 2593972 · · Fees: · You will not be charged any admin fees. · · · ** Contact today to book a viewing and have the landlord show you round! ** · Request Details form responded to 24/7, with phone bookings available 9am-9pm, 7 days a week. ·"
166240415,"1 bedroom flat share for rent in Mile End Road, London, E1",1 bedroom flat share,"£1,083 pcm",1083,pcm,1083,1,,Flat Share,RENT,True,False,"Mile End Road, London, E1",51.52304,-0.03906,020 3907 3502,02039073502,MacArthur Morrison,London,111 The Timberyard Drysdale Street London N1 6ND,,En-Suite Shower Room · Opposite QMUL · Wood Laminate Floor · Fitted Wardrobes With Fridge Compartment,7,0,"Single en-suite room - all bills included (with WIFI) student flat-share positioned opposite Queen Mary University of London opposite the campus. · · The apartment has been fitted to a high specification. The kitchen has high gloss cabinetry, granite worktop, a washer/dryer, breakfast bar, integrated appliances. · · The bedroom has plenty of storage, a desk, book shelving plus its own fridge. The flat is duplex and has five bedrooms each secure and let on a separate AST. · · There's a Sainsbury's Local on the ground floor of the development plus a wide variety of local food outlets. · · Mile End tube station 5 minutes walk. · · Duplex flat on the third floor (no lift). · · This flat is occupied by female (x 3) and male (x 2) students."
166240910,"1 bedroom flat share for rent in Kingston Hill, Kingston Upon Thames, KT2",1 bedroom flat share,"£1,084 pcm",1084,pcm,1084,1,1,Flat Share,RENT,True,False,"Kingston Hill, Kingston Upon Thames, KT2",51.416763,-0.283472,020 3322 3265,02033223265,Techbeard Ltd,London,"20 Wenlock Road, London, N1 7GU",,No Agent Fees · Room Only (Shared Flat) · Students Can Enquire · Property Reference Number: 2599497,7,0,"Property Reference: 2599497. · · 3 bedroom recently refurbished and furnished flat in purpose built building with lift and private car park. · · Top floor flat with stunning views of whole of Kingston and beyond into Surrey. · · 5 min walk to Norbiton Station, and short walk away from Richmond Park and local convenience stores. Bus stop for 57, 85 and 213 just outside the property. · · Well located for St Paul's and Alexandra primary schools and Combe Girl's secondary school. Also within optimum catchment for applying for Tiffin boys and girls. · · Ideal for long term rental to a family with children. · · Summary & Exclusions: · - Rent Amount: £1,084.00 per month (£250.15 per week) · - Deposit / Bond: £1,250.76 · - 3 Bedroom Property (1 room currently available for rent) · - 1 Bathrooms · - Property comes furnished · - Available to move in from 01 September 2025 · - Minimum tenancy term is 12 months · - Maximum number of tenants is 1 · - Students welcome to enquire · - No Pets, sorry · - No Smokers · - Family Friendly · - Bills not included · - Property has parking · - Property has garden access · - EPC Rating: EPC Not Required (Shared Accommodation) · · If calling, please quote reference: 2599497 · · Fees: · You will not be charged any admin fees. · · · ** Contact today to book a viewing and have the landlord show you round! ** · Request Details form responded to 24/7, with phone bookings available 9am-9pm, 7 days a week. ·"
166241045,1 bedroom flat for rent in Armoury Road SE8,1 bedroom flat,"£1,350 pcm",1350,pcm,1350,1,1,Flat,RENT,True,False,Armoury Road SE8,51.46835,-0.01693,020 3879 5172,02038795172,Leaders and Romans Group,Lewisham,"153 Lewisham High Street, London, SE13 6AA",,Available September  · Good Size One Bedroom Flat · Convenient for Lewisham DLR · Situated on a Quiet Road · View Now · Energy Efficiency Rating D,5,0,**AVAILABLE 17TH SEPTEMBER** · · Good size one bedroom flat conveniently located for the Lewisham DLR Station. The property is on a quiet road close to the heart of Lewisham's local amenities. View now to avoid disappointment. · · Energy Efficiency Rating D. · · Transport Links: · Elverson Road DLR Station (0.1 miles) Lewisham Railway Station (0.2 miles) Lewisham DLR Station (0.2 miles) St Johns Railway Station (0.3 miles) Deptford Bridge DLR Station (0.6 miles) · · Room dimensions pending verification. · · All known suppliers for mobile and broadband services are available in this area. · · Heating type: TBC · Electricity: TBC · Water and Sewerage: mains metered water/sewerage · · Flood Risk Verification: · Surface: Low · Rivers & Seas: Very Low To check broadband and mobile phone coverage please visit Ofcom here ofcom.org.uk/phones-telecoms-and-internet/advice-for-consumers/advice/ofcom-checker
166241471,"1 bedroom apartment for rent in The Old Courtyard, Park Road, Bromley, BR1",1 bedroom apartment,"£1,400 pcm",1400,pcm,1400,1,1,Apartment,RENT,True,False,"The Old Courtyard, Park Road, Bromley",51.4081,0.022419,020 8016 3415,02080163415,DAVID JAMES LETTING & PROPERTY MANAGEMENT,Bromley,"187c Southborough Lane, Bromley, BR2 8AR",,"1 bedroom apartment · Bathroom with shower over bath · Electric heating · EPC Band D · First floor property · Off-street parking · Popuilar location with easy reach of parks, shops, public transport",6,1,"Set within a well-maintained building, the property features a welcoming living room filled with natural light, creating a bright and versatile space to relax or entertain and is open plan to the fitted kitchen. · · There is a generously sized double bedroom and completing the layout is a well-appointed bathroom. · · The property benefits from electric heating, entry phone and residents parking. · · The apartment's location is a real highlight. Just a short stroll from Bromley North station, with further connections available at Bromley South and Sundridge Park, commuters will enjoy fast and frequent services into Central London. Bromley town centre is on your doorstep, offering a wide range of shops, restaurants, cafés, and leisure facilities including The Glades shopping centre and Churchill Theatre. Local parks and green spaces are also close by, providing the best of both urban living and outdoor relaxation. · · This property is perfectly suited to a professional single or couple seeking a well-connected home in one of Bromley's most desirable neighbourhoods. · · - Disclaimer · · These particular are set out as a general outline only for guidance and do not constitute any part of an offer or contract. Intending tenants should not rely on them as statements of presentation of fact, but must satisfy themselves by inspection or otherwise as to their accuracy. No person employed by this company has tested any included equipment and can give no authority to make any representation or warranty in respect of the property. · · Tenant Fees · We may charge a tenant any or all of the following when required: · 1. the rent; · 2. a security deposit with a maximum of 5 weeks rent, or 6 weeks on a property with rent over · £50,000 per year; · 3. a holding deposit of no more than one weeks' rent; · 4. default fee for late payment of rent (after 14 days); · 5. reasonable charges for lost keys or security fobs; · 6. payments associated with contract variation, at £50 or reasonable costs incurred if higher, when requested by the tenant; · 7. payments associated with early termination of the tenancy, when requested by the tenant; and · 8. payments in respect of bills - utilities, communication services, TV licence, council tax and green deal or other energy efficiency charges. · · David James Letting & Property Management are members of The Property Ombudsman (TPO) redress scheme. We abide by the TPO code of conduct. · · We are members of SAFEAGENT and have Client Money Protection Insurance(CMP) provided via SAFEAGENT/NALS. · · Council Tax Band: C · Holding Deposit: £323.07"
166251689,"1 bedroom flat share for rent in London, London, NW1",1 bedroom flat share,"£1,200 pcm",1200,pcm,1200,1,1,Flat Share,RENT,True,False,"London, London, NW1",51.54319,-0.1276,020 3322 3265,02033223265,Techbeard Ltd,London,"20 Wenlock Road, London, N1 7GU",,No Agent Fees · Room Only (Shared Flat) · Students Can Enquire · Bills Included · Property Reference Number: 2558971,11,0,"Property Reference: 2558971. · · ood size double room close to King's Cross, located on the ground floor on the back side of the building. It features a good-sized room with a two-seater sofa, a large desk, a fridge/freezer, double wardrobes and a chest of drawers. · The bathroom is fully tiled and includes a power shower. The kitchen is equipped with a washing machine, dryer, hob, and oven. · You will be sharing the kitchen and bathroom with only one other tenant. located between King's Cross, Caledonian Road, St. Pancras Station · · Summary & Exclusions: · - Rent Amount: £1,200.00 per month (£276.92 per week) · - Deposit / Bond: £1,384.61 · - 2 Bedroom Property (1 room currently available for rent) · - 1 Bathrooms · - Property comes furnished · - Available to move in from 27 August 2025 · - Minimum tenancy term is 6 months · - Maximum number of tenants is 1 · - Students welcome to enquire · - No Pets, sorry · - No Smokers · - Not Suitable for Families / Children · - Bills Included · - No Parking Available · - No Garden Access · - EPC Rating: EPC Not Required (Shared Accommodation) · · If calling, please quote reference: 2558971 · · Fees: · You will not be charged any admin fees. · · · ** Contact today to book a viewing and have the landlord show you round! ** · Request Details form responded to 24/7, with phone bookings available 9am-9pm, 7 days a week. ·"
166252583,"1 bedroom flat for rent in 28 High Street, Carshalton, SM5",1 bedroom flat,"£1,250 pcm",1250,pcm,1250,1,1,Flat,RENT,True,False,"28 High Street, Carshalton",51.365875,-0.158457,020 3835 5246,02038355246,Turners,Morden,"105 London Road, Morden, SM4 5HP",,"Parking is not included with the property; however, an annual season ticket may be obtained at a cost of £600 per annum · First floor · Brand New · Close to High Street · Available now · Unfurnished. · Council Band C which is 1925 per annum · Epc rating B Predicted cost per annum for Hot water, Lighting, Heating 379.00",6,1,"The referencing would require tenants to have an income 30 times the monthly rent. Which is £37,500 per annum. · · · To let, a stunning, 2 years old, one bedroom apartment with high ceilings, contemporary fittings and fixtures. Located just behind the High Street in Carshalton, this fantastic flat is walking distance to the ponds, parks and pubs. · · · This property offers any potential tenants the benefits of living in the centre of town while also being in a private spot tucked away behind the High Street. · Newly converted the property boasts a large, open-plan, warehouse style living space with loads of natural light and plenty of room for dining, entertaining and of course relaxing. · The high ceilings and chalk white walls are complimented by the stylish kitchen which has matte black cabinets, white metro tile splash-blacks and pale marble-effect work surface. Oak laminate floor adds to the contemporary feel. · · Being just off the High Street the apartment certainly passes the ‘pint of milk test’ with supermarkets, bakers and cafes all being on your doorstep. Carshalton Ponds and The Grove Park is just a short stroll away as are Carshalton Tennis Courts. There are a number of very popular bars and pubs in the area, while the train station and regular buses services all offer easy access into Sutton, Wallington and the wider area. · · To let, a stunning, brand new, one bedroom apartment with high ceilings, contemporary fittings and fixtures and a balcony. Located just behind the High Street in Carshalton, this fantastic flat is walking distance to the ponds, parks and pubs. · · · This property offers any potential tenants the benefits of living in the centre of town while also being in a private spot tucked away behind the High Street. · Newly converted the property boasts a large, open-plan, warehouse style living space with loads of natural light and plenty of room for dining, entertaining and of course relaxing. · The high ceilings and chalk white walls are complimented by the stylish kitchen which has matte black cabinets, white metro tile splash-blacks and pale marble-effect work surface. Oak laminate floor adds to the contemporary feel. · The Bedroom has soft, dove-grey carpet and measures approx 15’10” x 11’4” allowing plenty of room for a double bed and freestanding bedroom furniture. · Like the kitchen, the bathroom has been finished to a good quality specification with an easy to maintain, white 3-piece bath-suite; with shower over the bath and part-tiled walls. · A decked balcony provides a pleasant outdoor space and is not overlooked as it faces out onto commercial properties. · Being just off the High Street the apartment certainly passes the ‘pint of milk test’ with supermarkets, bakers and cafes all being on your doorstep. Carshalton Ponds and The Grove Park is just a short stroll away as are Carshalton Tennis Courts. There are a number of very popular bars and pubs in the area, while the train station and regular buses services all offer easy access into Sutton, Wallington and the wider area. · ·"
