id,title,subtitle,price,price_gbp,price_freq,price_pcm_est,bedrooms,bathrooms,property_type,transaction_type,available,archived,address_display,latitude,longitude,phone,phone_digits,agency_company,agency_branch,agency_address,tags,features,photos_count,floorplans_count,description
166161083,"1 bedroom flat share for rent in Lowood St, London, E1",1 bedroom flat share,£795 pcm,795,pcm,795,1,1,Flat Share,RENT,True,False,"Lowood St, London, E1",51.510303,-0.055477,020 3322 3265,02033223265,Techbeard Ltd,London,"20 Wenlock Road, London, N1 7GU",,No Agent Fees · Room Only (Shared Flat) · Students Can Enquire · Property Reference Number: 2456112,13,0,"Property Reference: 2456112. · · 3/4 double/King bedrooms, fully furnished, fitted kitchen with Quartz floor, tiled modern bathroom & a separate WC for convenience. · Very clean and nicely decorated to a high spec. · · Discover the perfect blend of comfort and convenience in this charming Flat located in the picturesque Shadwell & Wapping Neighbourhood (E1). This well-proportioned and spacious property offers double rooms, each a sanctuary of calm and privacy. · · Key Features: · · Location: Nestled in the heart of Shadwell, known for its serene ambiance and popularity among locals. · · Accessibility: Just a minute’s walk from Shadwell DLR and Overground stations, your gateway to London’s extensive transport network. · · Vibrant Surroundings: A mere 10-minute stroll to the lively St. Katharine Docks, where dining and entertainment options abound. · · Iconic Landmarks: Within a 15-minute walk, find yourself at the majestic Tower Bridge, a testament to London’s rich history. · · Academic Proximity: Also a 15-minute walk to Queen Mary University aswell as GreenWich University via DLR making it an ideal spot for students or academic professionals.六 · · Prime Location for Professionals: Just 2 miles away from the bustling heart of the City of London, this flat is a commuter’s dream. The short distance to the financial and commercial hub makes it an ideal residence for professionals who desire a quick and easy commute  · · Don’t miss out on the chance to make this your new home. For more information and to schedule a viewing, please don’t hesitate to contact us. · · · · EASY access to PUBLIC TRANSPORT: · - Bus Stop · - DLR station (Shadwell) · - Overground Station (Shadwell) · All 3 minutes walk from property. · · LOCAL AREAS: · - Tower Bridge - 10 minute walk or one stop by DLR · - Canary Wharf - 10 minutes by DLR · - Queen Mary University - 15 minute walk or quick bus trip · - Greenwich University 15 minutes by DLR · - Brick Lane/Shorditch - 10 minute walk or quick bus trip · · · The property comprises, 3/4 large double (all furnished). A full equipped kitchen with anything you need to live comfy, and a bathroom with bathtub shower, separate WC. · · PERFECT location if your working in Central London OR Canary Wharf. · You can easily access any route one stop away from Bank station via DLR · · You can also find local shops, supermarkets, amazing restaurants and pubs all walking distance · · TO MOVE IN: · -1 month rent · -advance · · Summary & Exclusions: · - Rent Amount: 4 rooms available, from £795.00 each per month (£183.46 per week) · - Deposit / Bond: from £0.00 per room · - 4 Bedroom Property (4 rooms currently available for rent) · - 1 Bathrooms · - Property comes furnished · - Available to move in from 24 August 2025 · - Minimum tenancy term is 6 months · - Maximum number of tenants is 4 · - Students welcome to enquire · - No Pets, sorry · - No Smokers · - Family Friendly · - Bills not included · - No Parking Available · - No Garden Access · - EPC Rating: EPC Not Required (Shared Accommodation) · · If calling, please quote reference: 2456112 · · Fees: · You will not be charged any admin fees. · · · ** Contact today to book a viewing and have the landlord show you round! ** · Request Details form responded to 24/7, with phone bookings available 9am-9pm, 7 days a week. ·"
166192535,"1 bedroom apartment for rent in Wallwood Road, London, E11",1 bedroom apartment,"£1,350 pcm",1350,pcm,1350,1,1,Apartment,RENT,True,False,"Wallwood Road, London, E11",51.57085,0.003469,020 3909 7829,02039097829,Rent Revolution,London,"Hello Neighbour, 14th Floor, Apex Tower, New Malden, London, KT3 4LH",,To book a viewing: submit your enquiry and you'll receive an email and SMS detailing availability - within 10 min,7,0,2nd floor flat. · · Consists of: · · -Kitchen · -Living room · -Bedroom · -Bathroom
166196081,"1 bedroom flat share for rent in Addiscombe Road, New Addington, Croydon, CR0",1 bedroom flat share,"£1,350 pcm",1350,pcm,1350,1,2,Flat Share,RENT,True,False,"Addiscombe Road, New Addington, Croydon, CR0",51.374928,-0.089602,020 3322 3265,02033223265,Techbeard Ltd,London,"20 Wenlock Road, London, N1 7GU",,No Agent Fees · Room Only (Shared Flat) · Students Can Enquire · Bills Included · Property Reference Number: 2475446,15,0,"Property Reference: 2475446. · · En-Suite Room to Rent – 2-3 Minutes from East Croydon Station – Ideal for a Professional A bright and spacious en-suite room is available in a well-maintained shared apartment, just a 2–3 minute walk from East Croydon Station. Perfect for a working professional seeking convenience, comfort, and excellent transport links. Key Features: Fully furnished room with a bed and wardrobePrivate en-suite bathroomShared fully equipped kitchen with friendly, respectful flatmates Location Highlights: Just 15 minutes by train to London Victoria, London Bridge, and Gatwick AirportExcellent transport links to Central London and the SouthClose to local amenities, shops, cafes, and gyms We are looking for a tidy and considerate professional to join a clean, peaceful household. Please get in touch to arrange a viewing or to ask any questions. · · Summary & Exclusions: · - Rent Amount: £1,350.00 per month (£311.54 per week) · - Deposit / Bond: £1,350.00 · - 3 Bedroom Property (1 room currently available for rent) · - 2 Bathrooms · - Property comes furnished · - Available to move in from 15 September 2025 · - Minimum tenancy term is 6 months · - Maximum number of tenants is 1 · - Students welcome to enquire · - Pets considered / by arrangement · - Smokers considered · - Family Friendly · - Bills Included · - No Parking Available · - Property has garden access · - EPC Rating: EPC Not Required (Shared Accommodation) · · If calling, please quote reference: 2475446 · · Fees: · You will not be charged any admin fees. · · · ** Contact today to book a viewing and have the landlord show you round! ** · Request Details form responded to 24/7, with phone bookings available 9am-9pm, 7 days a week. ·"
166202450,"1 bedroom apartment for rent in Mayes Road, Wood Green, N22",1 bedroom apartment,"£1,350 pcm",1350,pcm,1350,1,1,Apartment,RENT,True,False,"Mayes Road, Wood Green",51.5951,-0.11248,020 3834 7951,02038347951,Wilkinson Byrne,Harringay,"8 Turnpike Parade, Green Lanes, London, N15 3EA",,One Double Bedroom · Newly Fitted Kitchen · New Shower Room · Double Glazing · Gas Central Heating · Newly Refurbished · Close To Wood Green Underground Station · Available Now,8,0,"Modern One double top floor converted flat located with access to Wood Green Underground Station (Piccadilly Line Zone 3), Alexander Palace British Rail Mainline Station Wood Green Shopping City and all local transport and shopping facilities. The property offers a modern fitted kitchen, modern shower room, double glazing, gas central heating and is recently decorated. Utility area with washing machine. Available September 2025. UNFURNISHED"
166204223,"1 bedroom apartment for rent in Coombe Road, Croydon, CR0",1 bedroom apartment,"£1,300 pcm",1300,pcm,1300,1,1,Apartment,RENT,True,False,"Coombe Road, Croydon, CR0",51.366523,-0.091139,020 3870 2527,02038702527,Streets Ahead,Croydon Central,263 High Street South Croydon CR0 1QH,,PURPOSE BUILT FLAT · AVAILABLE IN SEPTEMBER · SEPERATE KITCHEN · GARAGE · CLOSE TO TRANSPORT · SHORT WALK TO TOWN CENTRE,9,0,"Call today to view this recently refurbished one bedroom purpose built flat located just a short walk away from Croydon town centre and all local transport links including South Croydon station. · · Offered to the market unfurnished, this property offers a large double bedroom with built in wardrobes, a large lounge, recently fitted kitchen, neat bathroom and ample storage. · · Also benefiting from a garage, this property will go quickly. · · Call now to view and don't miss out! · ·"
166204910,"1 bedroom flat for rent in Queens Road, Bromley, BR1",1 bedroom flat,"£1,350 pcm",1350,pcm,1350,1,1,Flat,RENT,True,False,"Queens Road, Bromley",51.40544,0.01773,020 3834 8753,02038348753,The Property Franchise Group,Beckenham,163 High Street Beckenham BR3 1AE,,Allocated Parking Space · Open Plan Kitchen/Living Room · Juliet Balcony · Close to both Bromley Stations · Next to Bromley Shopping Centre · One Bedroom,7,0,"A One Bedroom First Floor Flat ideally located next to Bromley Shopping Centre and both Bromley Train Stations. · · The spacious flat benefits from an allocated parking space, open plan kitchen, living room and bathroom. · · Offered unfurnished and available now"
166205333,"1 bedroom flat for rent in Courthill Road, Hither Green , London, SE13",1 bedroom flat,"£1,300 pcm",1300,pcm,1300,1,1,Flat,RENT,True,False,"Courthill Road, Hither Green , London, SE13",51.455274,-0.007376,020 3834 8664,02038348664,Robert Stanford Estate Agents,Hither Green,"37 Staplehurst Road, London, SE13 5ND",,One Bedroom Flat · Top Floor · 0.5mi to Hither Green Station · Furnished · Kitchen / Diner · Communal Garden,6,1,"An attractive one bedroom top floor flat situated in Courthill Road. Hither Green Station is only 0.5 miles away for ideal connection with Central London & The City, Lewisham Station with DLR connection is 1 mile away. Internally the flat includes a lounge, kitchen / diner, large double bedroom and bathroom. Offered furnished. Council : Lewisham Council Tax Band: (B)"
166206359,"1 bedroom flat for rent in Gallosson Road, Plumstead, SE18",1 bedroom flat,"£1,400 pcm",1400,pcm,1400,1,1,Flat,RENT,True,False,"Gallosson Road, Plumstead",51.487396,0.089634,01322 936891,01322936891,HAZELL HOLLAND LIMITED,Kent,"2 Cornelia Place, Erith, DA8 1RU",,"1 Bedroom  first floor conversion flat · 14'8 Lounge · Modern white kitchen with oven, hob and extractor fan · Double glazing · Gas central heating · Walking distance to High Street · Convenient for Plumstead and Woolwich station's with Elizabeth line links · Available end September",12,0,"Hazell Holland welcome on Gallosson Road in the central area of Plumstead, this delightful one-bedroom first-floor conversion flat . The property features a well-proportioned reception room, ideal for relaxation or entertaining guests, alongside a cosy bedroom that provides a peaceful retreat. The bathroom is thoughtfully designed, ensuring all your needs are met. · · This flat is situated within walking distance of the bustling high street, where you can find a variety of shops, cafes, and local amenities to cater to your everyday needs. For those who commute, Woolwich station is nearby, providing excellent transport links, including access to the Elizabeth Line, making travel to central London and beyond both quick and easy. · · The flat is in good condition, ready for you to move in and make it your own. Available at the end of September, this property presents a wonderful opportunity for those looking to rent. With its prime location and charming features, this flat is not to be missed. · · DEPOSIT - 5 WEEKS RENT £1,615.00 · · HOLDING DEPOSIT £372.69 · · PROSPECTIVE TENANTS WILL BE REQUIRED TO BE EARNING A MINIMUM TOTAL INCOME OF £42,000 PER ANNUM TO SHOW AFFORDABILITY FOR THIS PROPERTY. GUARANTORS WILL BE REQUIRED TO SHOW A MINIMUM TOTAL INCOME OF £50,400 · · Communal Entrance - · · First Floor Landing - · · Lounge - · · Kitchen - · · Bedroom - · · Bathroom - · ·"
166206509,"1 bedroom apartment for rent in Imperial Drive, North Harrow, HA2",1 bedroom apartment,"£1,400 pcm",1400,pcm,1400,1,1,Apartment,RENT,True,False,"Imperial Drive, North Harrow",51.57683,-0.3697,020 3873 7507,02038737507,Hinton Residential,Harrow Weald,"399 High Road, Harrow Weald, Harrow, HA3 6EL",,Large one bedroom apartment · Only a 3 minute walk to Rayners Lane station · Extremely modern throughout · Open plan lounge and kitchen · South facing balcony · Lift within the block  · Close to local shops &amp; transport facilities · Available end of September 2025 · Part Furnished,9,0,"Hinton & Downes are pleased to offer to the rental market, this extremely modern and excellent sized ONE BEDROOM FIRST FLOOR apartment situated within ""Carmine Court"" situated only a 3 minute walk to Rayners Lane Station (Metropolitan line), other local transport and many shopping facilities. · · The property has a large double bedroom, luxury family bathroom (with bath and shower over) and separate living room which is open plan to the modern fitted kitchen (with appliances) with doors that lead out onto the South facing balcony. · · The property is available for occupation as of 10th July 2022 and is offered to the market being PART FURNISHED."
166207109,"1 bedroom flat for rent in Chelsea Close, Hampton, TW12",1 bedroom flat,"£1,350 pcm",1350,pcm,1350,1,1,Flat,RENT,True,False,"Chelsea Close, Hampton",51.427022,-0.357374,020 8783 3633,02087833633,Dexters,Hampton,"197 / 201 High Street, Hampton Hill, Hampton, TW12 1NL",,Spacious Double Bedroom · Bright and Open Reception · Integrated Kitchen · Modern Bathroom · Moments from High Street &amp; Bushy Park,4,0,"A well presented one double bedroom apartment that is bright throughout and has an open plan living room and kitchen, a modern bathroom suite and a generously sized double bedroom. · · Chelsea Close is a quiet road located within walking distance to Hampton Hill High Street with its shops and bars whilst also being well located for Bushy Park and Fulwell train station with direct links into London Waterloo. · · Security Deposit: £1,557 · Council Tax Band: B · · Information contained within this listing is for guidance only and should be checked and confirmed (prior to proceeding). · ·"
166208774,"1 bedroom apartment for rent in Delta Point, Wellesley Road, Croydon, CR0 2NY, CR0",1 bedroom apartment,"£1,350 pcm",1350,pcm,1350,1,1,Apartment,RENT,True,False,"Delta Point, Wellesley Road, Croydon, CR0 2NY",51.378972,-0.100466,020 3840 3484,02038403484,Criterion Hospitality Limited,DSTRKT,"16 Babmaes Street, London, SW1Y 6HD",BUILT_FOR_RENTERS,"Delta Point, a landmark building known for its role as Gotham General Hospital in The Dark Knight Rises offers: · Concierge and Maintenance Service at no extra cost · Contemporary Design · Unfurnished with Integrated White goods (Fridge/Freezer, Washing Machine &amp; Electric Hob/Oven). · CCTV coverage throughout the property · Secured Underground Parking *Fees Apply*",5,1,"Fully modern, open plan Designed 1 bedroom & bathroom flat, available in the heart of Croydon. · · This property offers an open-plan living spaces, modern bathroom and integrated kitchen appliances. Perfect for professionals who work from home who need a work station or a couple/small family. The bedroom is thoughtfully designed with built-in wardrobes, while selected layouts offer en-suite options for added comfort and privacy. · · Ideally located for commuters, Delta Point is a short walk from both West Croydon and East Croydon stations, providing easy connections to central London and beyond. With excellent access to bus routes, travel is as convenient as it is efficient. · · Delta Point's selected flats offers panoramic views across London and Surrey. Surrounded by Croydon’s array of shops, restaurants, cafes, and entertainment venues, Delta Point is perfectly positioned for an exciting urban lifestyle. · · Note: All flats are offered unfurnished, white goods are provided allowing residents to personalise their living spaces. (Furniture shown in images is for illustrative purposes only.)"
166212488,"1 bedroom flat for rent in Kent House Road, London, SE26",1 bedroom flat,"£1,225 pcm",1225,pcm,1225,1,1,Flat,RENT,True,False,"Kent House Road, London, SE26",51.42409,-0.04301,020 3906 8972,02039068972,Live London Estates Limited,Golders Green,"Office 4, Zohar Court, 2A Highfield Avenue, London, NW11 9ET",,,5,0,Lovely One bedroom flat · · - Double bedroom · - Central heating · - Second floor · - Furnished/unfurnished · - Close to shops and local amenities. · - No Bills Included
166213538,"1 bedroom apartment for rent in Holmesdale Road, London, SE25",1 bedroom apartment,"£1,300 pcm",1300,pcm,1300,1,1,Apartment,RENT,True,False,"Holmesdale Road, London, SE25",51.398594,-0.08138,020 3907 9942,02039079942,Streets Ahead,South Norwood,"25 High Street, London, SE25 6EZ",,,7,0,One bedroom first floor flat that has been completely refurbished throughout including new kitchen & bathroom. · · Located on the first floor of a period conversion the flat is available now & offered unfurnished. · · Located a short distance from Norwood Junction Station & local amenities. · ·
166214555,"1 bedroom apartment for rent in Vignoles Road, Romford, Essex, RM7",1 bedroom apartment,"£1,000 pcm",1000,pcm,1000,1,1,Apartment,RENT,True,False,"Vignoles Road, Romford, Essex, RM7",51.569427,0.15331,020 3909 6750,02039096750,Ashton Estate Agency Ltd,Chadwell Heath,"1 High Road, Chadwell Heath, Romford, RM6 6PX",,"AVAILABLE FROM 5/9/2025 · EPC Rating D · Council Tax Band TBC · Holding Deposit £230 · Deposit £1,000 · Studio Flat · Communal Parking · Fitted Kitchen · Available 5/9/25",6,0,"A FIRST FLOOR MODERN PUROSE BUILT STUDIO FLAT, SITUATED IN THIS POPULAR DEVELOPMENT OFF CROW LANE. · · *LOUNGE - ARCHWAY TO BEDROOM *BATHROOM *FITTED KITCHEN *ELECTRIC HEATING *COMMUNAL PARKING * PART FURNISHED · · AVAILABLE FROM 5/9/2025 · · EPC Rating D · Council Tax Band TBC · Holding Deposit £230 · Deposit £1,000 · · Studio Flat · Communal Parking · Fitted Kitchen · Available 5/9/25 · ·"
166215215,"1 bedroom flat for rent in Chipstead Valley Road, Coulsdon, CR5",1 bedroom flat,"£1,175 pcm",1175,pcm,1175,1,1,Flat,RENT,True,False,"Chipstead Valley Road, Coulsdon",51.320839,-0.139263,020 3840 3679,02038403679,Valley Homes,Coulsdon,"25 Chipstead Valley Road, Coulsdon, CR5 2RB",, Double Bedroom · Spacious Lounge/diner ·  Bathroom  · Fitted Kitchen · Double Glazing · Outside terrace,6,0,"A larger than average 1 bedroom maisonette with its own outside terrace is located in the Centre of Coulsdon close to all amenities. · · The property is located in the heart of Coulsdon with its good range of shopping and leisure facilities. Comprising of entrance hall, spacious open plan living room/dining room area, fitted kitchen, bedroom and modern bathroom suite. The property also benefits from electric heating and double glazing throughout and own large terrace providing great outside space. Early Viewing advised · · Council Tax Band B · EPC Rating C"
166215749,"1 bedroom apartment for rent in Victoria Grove, London, N12",1 bedroom apartment,"£1,400 pcm",1400,pcm,1400,1,1,Apartment,RENT,True,False,"Victoria Grove, London, N12",51.616088,-0.172187,020 3910 6512,02039106512,Jayson Russell,Hendon,"20 Parson Street, London, NW4 1QB",,,7,0,"Ground floor 1bed apartment in a great location, near local shops & transport links. Flat benefits from, modern fitted kitchen, bathroom with bathtub, good size bedroom & bright & spacious living room. Offered part-furnished & available from 6th September 2025. · ·"
166217918,"1 bedroom apartment for rent in Selwood House, Kemnal Road, Chislehurst, BR7",1 bedroom apartment,"£1,275 pcm",1275,pcm,1275,1,1,Apartment,RENT,True,False,"Selwood House, Kemnal Road, Chislehurst",51.418312,0.07496,020 3834 8287,02038348287,Hunters Property Group Ltd,Bromley & Chislehurst,219 High Street Bromley BR1 1NY,,ONE BEDROOM · GROUND FLOOR · CONVERSION FLAT · SELF CONTAINED · RESIDENTS PARKING · COMMUNAL GARDEN · CHISLEHURST STATION 1.2 MILES · EPC RATING E,9,1,"Available for rental is this one bed ground floor flat situated in a characterful historic building in one of Chislehurst's most desirable private roads. Forming part of this former sheltered housing scheme, the accommodation is basically appointed, but offers an affordable option for those seeking budget accommodation. The area is delightful with access to the nearby commons, high street, and ponds. Applications via Bromley's homeless scheme will be considered if sanctioned by Bromley Council's lettings team. · · A one bedroom period conversion flat in a delightful Victorian building in one of Chislehurst's highly desirable private roads. EPC Rating E. · · Bedroom · · . - Bathroom · · .. - Kitchen · ·"
166218032,"1 bedroom apartment for rent in Sutton Court Road, Sutton, SM1",1 bedroom apartment,"£1,350 pcm",1350,pcm,1350,1,1,Apartment,RENT,True,False,"Sutton Court Road, Sutton",51.36073,-0.19108,020 3909 9714,02039099714,Leaders and Romans Group,Sutton,2-4 Mulgrave Road Sutton SM2 6LE,, AVAILABLE AT THE START OF OCTOBER · MODERN ONE BEDROOM APARTMENT · BALCONY  · OPEN PLAN KITCHEN AND LIVING ROOM · NEST CONTROLLED GAS CENTRAL HEATING · EXCELLENT LOCATION FOR TRAIN STATION AND TOWN CENTRE,10,1,"***AVAILABLE AT THE START OF OCTOBER - CLICK TO SEE 360 VIRTUAL TOUR*** Leaders Sutton are pleased to bring to the market this modern One Bedroom Apartment located in the Heart of Sutton Town Centre. Ideally placed for Mainline Station and Transport. The property comprises of Open-plan Living area with door onto Balcony, high quality finish kitchen with White Gloss Units, Integrated Fridge, Washer/Dryer, Dishwasher, Double Bedroom and a superb modern Bathroom with White Suite and sparkling Black Tiles. Other benefits include Laminate flooring throughout, Gas Central Heating which is Nest controlled, Video Entry Phone, Lift Service and Double Glazing. Please note this property does not come with parking. · · Holding deposit - £311 - based on the advertised rent, to secure the property whilst referencing is conducted, the holding deposit will be off set against the full security deposit that is equivalent to five weeks rent. · · 5 Week deposit - £1557 - Collected along with your first month’s rent, based on the advertised rent. · · EPC Rating – C · · Council Tax – B · · Rent: £1350pcm excludes the tenancy deposit and any other permitted payments. · · Term: one-year fixed term, subject to negotiation. · · Parking: Allocated parking · · Utilities: electric and mains water & sewerage. please contact for more information. · · Broadband and phone: We understand that most broadband providers service the area, and the onus is on you the consumer to ascertain the viability of service to the property. Broadband options and phone signal can be obtained from the Ofcom broadband and mobile coverage checker · · Rooms sizes/Floor plan: Whilst every care is taken to provide as accurate as possible floor plans and room sizes, these are a guide only and cannot be relied upon. Therefore, you must make your own investigations and measurements to satisfy any specific need. · · Tenants Insurance: As part of the Governments How to Rent Guide, it is highly recommended that Tenants take out the appropriate contents insurance to protect their belongings as this will not be covered by any landlord policy. · · Build: Standard construction brick built. · · More information: Please refer to our website or contact your local branch for more information or further clarity."
166218413,"1 bedroom apartment for rent in Zero Deposit Option Available. Kidderminster Road, Croydon CR0 2UF, CR0",1 bedroom apartment,£900 pcm,900,pcm,900,1,1,Apartment,RENT,True,False,"Zero Deposit Option Available. Kidderminster Road, Croydon CR0 2UF",51.38229,-0.10401,020 3835 6224,02038356224,Countrywide UK Lettings,Croydon,"22 Norfolk House, George Street, Croydon, CR0 1LG",LET_AGREED,One Bedroom Conversion · Excellent Condition Throughout · Great Size · White Goods · Large Double Bedroom · First Floor · Garage · Close to regular Bus Services · Easy Access to West Croydon BR · Close to Local Shops,10,0,"Zero Deposit Option Available. Bairstow eves are delighted to offer to the market this very well presented first floor, one bedroom conversion flat. Offered unfurnished, accommodation comprises entrance hallway, spacious bright lounge, kitchen/breakfast room, modern fitted bathroom suite and there is off street parking. · · Benefits include gas central heating, parking to the rear, good decor throughout, excellent size and is located within walking distance of West Croydon shops and train station · · Croydon offers not only the usual array of high street chains but also a wide range of independent specialist shops. As well as easy access to the famous Purley Way and retail parks which offer an abundance of superstores including furniture, clothing and electronic goods. · · Croydon is also notable for its wide variety of restaurants and bars. Why not opt for one of the many historic pubs, or even a fashionable wine bar. If you are hungry you can choose from restaurants offering English, Spanish, Indian, Thai, Argentinean, Italian or Chinese food and the famous box park! · · Viewing is highly recommended. Available now! Council Tax Band: Holding Deposit: £0.00"
